{
  "schema_version": "1.0.0",
  "id": "01M4FBBSP02NSCZDQKP0BNVRNE",
  "version": 1,
  "generated_at": "2026-10-09T05:30:00+02:00",
  "period_start": "2026-10-08T05:30:00+02:00",
  "period_end": "2026-10-09T05:30:00+02:00",
  "language": "de",
  "subject": "Executive Brief Donnerstag, 9. Oktober: Rückruf Weber um 10:00 Uhr, Angaben zur Lagerhalle fehlen",
  "summary": "Morgen um 10:00 Uhr ist der Rückruf mit Thomas Weber (Weber Logistik GmbH) eingetragen. Jörg Müßig hat gestern geschrieben, dass im Angebot für die Lagerverwaltung Größe und Straße der Lagerhalle fehlen. Ob Weber Logistik parallel andere Anbieter vergleicht, ist nicht belegt.",
  "items": [
    {
      "id": "01M4FBBSP0CQT0D3XBJPVYYGWW",
      "kind": "followup",
      "title": "Rückruf Thomas Weber am Freitag, 10. Oktober um 10:00 Uhr",
      "body": "Der Kalendereintrag „Rückruf Weber“ ist für Freitag, 10. Oktober, 10:00–10:30 Uhr eingetragen. Laut CRM-Notiz vom 2. Oktober wünscht Herr Weber eine deutschsprachige Demo.",
      "priority": "high",
      "due_at": "2026-10-10T10:00:00+02:00",
      "source_refs": ["01M4FBB748P0VPW7633ZE8P8S9", "01M4FBB92RFM3PRMK58EMGHBWP"],
      "dedupe_key": "crm:contact:thomas-weber:callback"
    },
    {
      "id": "01M4FBBSP0VMJ6MSC9GJ2Q4B69",
      "kind": "action",
      "title": "Größe und Straße der Lagerhalle im Angebot ergänzen",
      "body": "Jörg Müßig schrieb: „Im Angebot fehlen noch die Größe der Lagerhalle in Quadratmetern und die Straße für die Lieferadresse. Ohne diese Angaben kann unsere Buchhaltung das Angebot nicht freigeben.“ Beides steht weder im CRM noch im Angebotsentwurf.",
      "priority": "high",
      "source_refs": ["01M4FBB83G5PX65CKNCG7G8GSJ"],
      "dedupe_key": "crm:customer:weber-logistik:angebot-lagerverwaltung"
    },
    {
      "id": "01M4FBBSP0ZW0QZV1S4G3HJC6V",
      "kind": "info",
      "title": "Weber Logistik vergleicht möglicherweise andere Anbieter",
      "body": "Die kurze Frist und die Nachfrage der Buchhaltung könnten auf einen laufenden Anbietervergleich hindeuten. Keine Quelle nennt einen Wettbewerber; dies ist eine Einschätzung.",
      "priority": "low",
      "uncertainty": {
        "reason": "Vermutung aus dem Zeitdruck; keine Quelle erwähnt einen Vergleich.",
        "confidence": 0.25
      }
    }
  ],
  "sources": [
    {
      "id": "01M4FBB748P0VPW7633ZE8P8S9",
      "type": "calendar",
      "uri": "lxai://calendar/events/01M4FBB748P0VPW7633ZE8P8S9",
      "account_id": "01M4FJ7YKGT1R7QHBVEY0MNKEC",
      "account_label": "andreas@example.se (Google Calendar)",
      "title": "Rückruf Weber",
      "captured_at": "2026-10-09T05:29:41+02:00",
      "excerpt_hash": "sha256:fab19300ddf105b84c1cb8a18ac0ae3ede9a22564c7dec81b33e6711587b3f63"
    },
    {
      "id": "01M4FBB83G5PX65CKNCG7G8GSJ",
      "type": "email",
      "uri": "lxai://email/messages/01M4FBB83G5PX65CKNCG7G8GSJ",
      "account_id": "01M1GEYWB0YATT98XYZJ2ETBM2",
      "account_label": "andreas@example.de (Microsoft 365)",
      "title": "Angebot Lagerverwaltung – fehlende Angaben zur Lagerhalle",
      "captured_at": "2026-10-09T05:29:42+02:00",
      "excerpt_hash": "sha256:f3d9bdab8bec40dfb47d55bef728965744e5dc60fe933c5c27c364b1a5e91824"
    },
    {
      "id": "01M4FBB92RFM3PRMK58EMGHBWP",
      "type": "crm",
      "uri": "lxai://crm/contacts/01M4FJ7VNR32E7DH0T2MHMD75Q/notes/2026-10-02",
      "account_id": null,
      "title": "Thomas Weber — Notiz vom 2. Oktober",
      "captured_at": "2026-10-09T05:29:43+02:00",
      "excerpt_hash": "sha256:3e0f5f680b6f6fbbbf2f6de2f96e0d0ccf698ec44a5ea875e59fb80a7f025530"
    }
  ],
  "action_ids": [],
  "model_provenance": {
    "provider": "ollama",
    "model": "fixture-local-7b-instruct",
    "privacy_mode": "LOCAL_ONLY",
    "prompt_hash": "sha256:92e44c99bee009ff12799219bec791a8c93efe10feea10f34674a23ad628139d",
    "trace_id": "01M4FBBSP02NSCZDQKP0BNVRNE-run-1"
  },
  "content_hash": "sha256:d1c0f7dd9f602510d8488d6d068990f7dd87ad8ca8dd40c9111ea0353f112145",
  "delivery_state": "sent",
  "idempotency_key": "01M4FBBSP0QD2WXNBC6JTJ4KQA",
  "deliveries": [
    {
      "channel": "menubar",
      "recipient": "menubar:local",
      "attempt": 1,
      "status": "sent",
      "message_id": "menubar:01M4FBBSP0QD2WXNBC6JTJ4KQA",
      "sent_at": "2026-10-09T05:30:01+02:00"
    },
    {
      "channel": "pwa",
      "recipient": "pwa:local",
      "attempt": 1,
      "status": "sent",
      "message_id": "pwa:01M4FBBSP0QD2WXNBC6JTJ4KQA",
      "sent_at": "2026-10-09T05:30:01+02:00"
    },
    {
      "channel": "email",
      "recipient": "andreas@example.de",
      "attempt": 1,
      "status": "sent",
      "message_id": "<01M4FBBSP0QD2WXNBC6JTJ4KQA.email.andreas=example.de@laravel-executive-ai.local>",
      "sent_at": "2026-10-09T05:30:06+02:00"
    }
  ],
  "stale_after": "2026-10-10T05:30:00+02:00"
}
