{
  "schema_version": "1.0.0",
  "id": "01M4A6JBP0XJME79JHMB6GK3T9",
  "version": 1,
  "generated_at": "2026-10-07T05:30:00+02:00",
  "period_start": "2026-10-06T05:30:00+02:00",
  "period_end": "2026-10-07T05:30:00+02:00",
  "language": "en",
  "subject": "Executive Brief Tuesday 7 October: offer sent to Nordlund Bygg, Weber callback booked",
  "summary": "The offer to Nordlund Bygg AB went out this morning. A callback with Thomas Weber is in the calendar for Friday. Nothing is overdue. (This brief is deliberately older than the fixture clock so renderers can be tested in the stale state; its content is ordinary.)",
  "items": [
    {
      "id": "01M4A6JBP0ETPJ40GJ2PHXF157",
      "kind": "info",
      "title": "Offer 2026-114 sent to Nordlund Bygg AB",
      "body": "You sent offer 2026-114 (184 000 kr, rebuild of the warehouse in Mölndal) to Karin Nordlund at 09:12. No reply yet, which is expected on the day it was sent.",
      "priority": "normal",
      "source_refs": ["01M4A6HS48TGF3SFEJ6H9XSZ0H"],
      "dedupe_key": "crm:customer:nordlund-bygg:offer:2026-114"
    },
    {
      "id": "01M4A6JBP08PJH3HWASMK7SYC8",
      "kind": "followup",
      "title": "Callback with Thomas Weber on Friday 10 October at 10:00",
      "body": "The calendar event \"Rückruf Weber\" is booked for Friday 10 October 10:00–10:30. Thomas Weber asked for a German-language demo of the warehouse management offer.",
      "priority": "normal",
      "due_at": "2026-10-10T10:00:00+02:00",
      "source_refs": ["01M4A6HT3GARESGSGW274PXMFE"],
      "dedupe_key": "crm:contact:thomas-weber:callback"
    }
  ],
  "sources": [
    {
      "id": "01M4A6HS48TGF3SFEJ6H9XSZ0H",
      "type": "email",
      "uri": "lxai://email/messages/01M4A6HS48TGF3SFEJ6H9XSZ0H",
      "account_id": "01M4FJ7YKGT1R7QHBVEY0MNKEC",
      "account_label": "andreas@example.se (Google Workspace)",
      "title": "Offert 2026-114 ombyggnad lager Mölndal",
      "captured_at": "2026-10-07T05:29:41+02:00",
      "excerpt_hash": "sha256:05488f115f79b6f993737598196cb5e3870844e0da7c923034374633e634fe01"
    },
    {
      "id": "01M4A6HT3GARESGSGW274PXMFE",
      "type": "calendar",
      "uri": "lxai://calendar/events/01M4A6HT3GARESGSGW274PXMFE",
      "account_id": "01M4FJ7YKGT1R7QHBVEY0MNKEC",
      "account_label": "andreas@example.se (Google Calendar)",
      "title": "Rückruf Weber",
      "captured_at": "2026-10-07T05:29:42+02:00",
      "excerpt_hash": "sha256:bd0b74e92008421bd87ee73c654a32e1423dc892fd28f36d1493bbc00b90f90c"
    }
  ],
  "action_ids": [],
  "model_provenance": {
    "provider": "ollama",
    "model": "fixture-local-7b-instruct",
    "privacy_mode": "LOCAL_ONLY",
    "prompt_hash": "sha256:7cefc7b150ed9ecea75b1b4580e0a585dc362d0837a6d2e0adbf79bf9c53b9e6",
    "trace_id": "01M4A6JBP0XJME79JHMB6GK3T9-run-1"
  },
  "content_hash": "sha256:07688be162a7f63ee50794b6fae7229e7b5d5e32d057f2a071937922cd71a103",
  "delivery_state": "sent",
  "idempotency_key": "01M4A6JBP0GFT7TGD8DD1XW3CD",
  "deliveries": [
    {
      "channel": "menubar",
      "recipient": "menubar:local",
      "attempt": 1,
      "status": "sent",
      "message_id": "menubar:01M4A6JBP0GFT7TGD8DD1XW3CD",
      "sent_at": "2026-10-07T05:30:01+02:00"
    },
    {
      "channel": "pwa",
      "recipient": "pwa:local",
      "attempt": 1,
      "status": "sent",
      "message_id": "pwa:01M4A6JBP0GFT7TGD8DD1XW3CD",
      "sent_at": "2026-10-07T05:30:01+02:00"
    },
    {
      "channel": "email",
      "recipient": "andreas@example.se",
      "attempt": 1,
      "status": "sent",
      "message_id": "<01M4A6JBP0GFT7TGD8DD1XW3CD.email.andreas=example.se@laravel-executive-ai.local>",
      "sent_at": "2026-10-07T05:30:05+02:00"
    }
  ],
  "stale_after": "2026-10-08T05:30:00+02:00"
}
